AG,CCAR,33.917,-91.772,72 m,27 km,2.5 km,2.10,0.06,6.201 km/s,2.953 km/s,0.35,42,0.61,Cane Creek AR,Arkansas Seismic Network
US,WVOR,42.43395,-118.63672,1344 m,33 km,0.1 km,1.72,0.00,6.279 km/s,3.651 km/s,0.24,200,0.51,Wild Horse Valley Oregon USA,United States National Seismic Network
WY,YNR,44.7155,-110.67917,2336 m,28 km,12 km,1.73,0.04,6.35 km/s,3.671 km/s,0.25,46,0.68,Norris Junction YNP WY USA,Yellowstone Wyoming Seismic Network
AG,WHAR,35.29,-92.289,184 m,44 km,0.3 km,1.71,0.02,6.498 km/s,3.8 km/s,0.24,146,0.54,Woolly Hollow State ParkAR,Arkansas Seismic Network
NM,GNAR,35.965,-90.018,71 m,27 km,7.8 km,2.10,0.17,6.273 km/s,2.987 km/s,0.35,51,0.71,GosnellAR,Cooperative New Madrid Seismic Network
CC,WIFE,44.05966,-121.81746,1955 m,31 km,0.4 km,2.00,0.02,6.597 km/s,3.299 km/s,0.33,91,0.48,Wife at 3-Sisters,Cascade Chain Volcano Monitoring
NM,PEBM,36.113,-89.862,76 m,39 km,0.3 km,1.66,0.01,6.444 km/s,3.882 km/s,0.22,77,0.74,Pemiscot BayouMO,Cooperative New Madrid Seismic Network
IM,NV31,38.4328,-118.153,1585 m,36 km,0.2 km,1.72,0.00,6.279 km/s,3.651 km/s,0.24,200,0.52,NVAR Array Mina NV USA,International Miscellaneous Stations
UU,CCUT,37.5506,-113.3627,2127 m,37 km,0.3 km,1.79,0.02,6.194 km/s,3.46 km/s,0.27,181,0.54,Cedar City UT USA,University of Utah Regional Network
TA,O02D,40.1766,-122.7884,965 m,39 km,2.2 km,1.82,0.13,6.566 km/s,3.608 km/s,0.28,97,0.61,Mt. Diablo Meridian CA USA,USArray Transportable Network (new EarthScope stations)
MB,JTMT,47.74667,-114.2825,1469 m,38 km,0.1 km,1.69,0.01,6.622 km/s,3.918 km/s,0.23,146,0.52,Jette Lake Montana,Montana Regional Seismic Network
TA,I04A,43.7941,-122.4113,731 m,57 km,14 km,2.10,0.02,6.522 km/s,3.106 km/s,0.35,200,0.91,Tendick Farm Oakridge OR USA,USArray Transportable Network (new EarthScope stations)
UU,ASI2,44.5744,-114.2577,1600 m,27 km,16 km,1.82,0.15,6.577 km/s,3.614 km/s,0.28,40,0.76,Darling Creek Challis ID USA,University of Utah Regional Network
UW,HEBO,45.2135,-123.75539,875 m,34 km,0.8 km,2.06,0.15,6.566 km/s,3.187 km/s,0.35,95,0.85,Mt. Hebo OR CREST BB SMO,Pacific Northwest Regional Seismic Network
UW,HOOD,45.32145,-121.65335,1520 m,40 km,3.1 km,1.81,0.07,6.597 km/s,3.645 km/s,0.28,200,0.66,Mt Hood Meadows OR CREST BB SMO,Pacific Northwest Regional Seismic Network
TA,R11A,38.3489,-115.5854,1756 m,32 km,0.2 km,1.76,0.01,6.276 km/s,3.566 km/s,0.26,200,0.39,Troy Canyon Currant NV USA,USArray Transportable Network (new EarthScope stations)
TA,F05D,45.8852,-121.4597,472 m,35 km,0.4 km,2.08,0.01,6.597 km/s,3.172 km/s,0.35,144,0.68,White Salmon WA USA,USArray Transportable Network (new EarthScope stations)
UW,LTY,47.25588,-120.66482,970 m,47 km,3.3 km,1.76,0.07,6.597 km/s,3.748 km/s,0.26,200,0.76,Liberty (broad-band),Pacific Northwest Regional Seismic Network
UW,DAVN,47.8006,-118.2741,495 m,30 km,0.1 km,1.70,0.01,6.419 km/s,3.776 km/s,0.24,200,0.25,Chrisman Ranch Davenport WA USA,Pacific Northwest Regional Seismic Network
UW,LON,46.7506,-121.8096,853 m,36 km,13 km,1.88,0.14,6.597 km/s,3.509 km/s,0.30,200,0.77,Longmire CREST broad-band,Pacific Northwest Regional Seismic Network
TA,A04D,48.7201,-122.7063,13 m,40 km,0.8 km,1.67,0.02,6.566 km/s,3.932 km/s,0.22,112,0.71,Lummi Island WA USA,USArray Transportable Network (new EarthScope stations)
NN,RUB,39.0517,-120.1549,2045 m,40 km,4.5 km,1.86,0.11,6.597 km/s,3.547 km/s,0.30,61,0.69,Rubicon Trail California w84,Western Great Basin/Eastern Sierra Nevada
US,HAWA,46.3925,-119.53264,364 m,36 km,0.7 km,1.70,0.04,6.419 km/s,3.776 km/s,0.24,200,0.66,Hanford Washington USA,United States National Seismic Network
ZW13,IFCF,32.9606,-96.9591,136 m,51 km,6.8 km,1.60,0.14,6.38 km/s,3.987 km/s,0.18,8,0.86,Coppell Firestation,Locating North Texas Earthquakes
IW,FXWY,43.6381,-111.0268,2254 m,38 km,0.1 km,1.86,0.01,6.207 km/s,3.337 km/s,0.30,200,0.36,Fox Creek Wyoming USA,Intermountain West
AZ,TRO,33.5234,-116.4257,2628 m,27 km,0.1 km,1.83,0.01,6.264 km/s,3.423 km/s,0.29,200,0.25,AZ.TRO,ANZA Regional Network
GS,KAN01,37.15342,-97.75897,360 m,40 km,4.6 km,1.80,0.07,6.483 km/s,3.602 km/s,0.28,23,0.80,Ward Farm Argonia KS USA,US Geological Survey Networks
IW,IMW,43.897,-110.9392,2646 m,38 km,2.7 km,1.81,0.08,6.207 km/s,3.429 km/s,0.28,200,0.74,Indian Meadow Wyoming USA,Intermountain West
NM,CLTN,36.09115,-86.3315,208 m,43 km,7.1 km,2.10,0.18,6.444 km/s,3.069 km/s,0.35,174,0.88,Cedars of LebanonTN,Cooperative New Madrid Seismic Network
GS,DEC10,39.890766,-88.91811,210 m,49 km,9.0 km,1.81,0.08,6.444 km/s,3.56 km/s,0.28,18,0.76,Decatur Surface Seismic Site Decatur IL USA,US Geological Survey Networks
US,ELK,40.74484,-115.23878,2210 m,30 km,0.1 km,1.76,0.01,6.276 km/s,3.566 km/s,0.26,200,0.44,Elko Nevada USA,United States National Seismic Network
US,HLID,43.5625,-114.41378,1772 m,42 km,0.3 km,1.67,0.00,6.291 km/s,3.767 km/s,0.22,200,0.52,Hailey Idaho USA,United States National Seismic Network
UW,RADR,46.42181,-123.79897,591 m,32 km,2.5 km,1.87,0.05,6.566 km/s,3.511 km/s,0.30,112,0.67,Radar Ridge Naselle WA,Pacific Northwest Regional Seismic Network
US,NLWA,47.39,-123.87,610 m,28 km,0.2 km,1.64,0.01,6.566 km/s,4.004 km/s,0.20,200,0.63,Neilton Lookout Washington USA,United States National Seismic Network
CC,CIHL,43.75097,-121.14862,1966 m,27 km,12 km,1.60,0.18,6.597 km/s,4.123 km/s,0.18,79,0.95,Cinder Hill Newberry OR,Cascade Chain Volcano Monitoring
IW,MFID,43.4151,-115.8278,1302 m,32 km,0.2 km,1.90,0.01,6.291 km/s,3.311 km/s,0.31,200,0.26,Camas Ranch Mayfield ID USA,Intermountain West
CI,BEL,34.0006,-115.9982,1388 m,28 km,0.2 km,1.78,0.01,6.276 km/s,3.526 km/s,0.27,200,0.55,Belle Mtn Joshua Tree National Park CA USA,Caltech Regional Seismic Network
CI,FUR,36.46703,-116.86322,-37.0 m,25 km,0.0 km,1.88,0.01,6.279 km/s,3.34 km/s,0.30,200,0.61,Furnace Creek CA USA,Caltech Regional Seismic Network
KY,CUSSO,36.55224,-89.329704,91 m,33 km,5.1 km,1.71,0.09,6.444 km/s,3.768 km/s,0.24,39,0.67,Central United States Seismic Observatory,Kentucky Seismic and Strong Motion Network
US,BOZ,45.64697,-111.62964,1589 m,35 km,0.2 km,1.76,0.01,6.35 km/s,3.608 km/s,0.26,200,0.40,Bozeman Montana USA,United States National Seismic Network
AG,FCAR,35.89,-92.124,190 m,41 km,0.2 km,1.75,0.01,6.498 km/s,3.713 km/s,0.26,141,0.30,Ozark Folk CenterAR,Arkansas Seismic Network
CO,HODGE,34.2315,-82.2586,151 m,38 km,1.0 km,1.69,0.03,6.35 km/s,3.757 km/s,0.23,112,0.60,Hodges SC USA,South Carolina Seismic Network
UU,HVU,41.77967,-112.775,1609 m,33 km,3.4 km,1.83,0.09,6.276 km/s,3.43 km/s,0.29,200,0.63,Hansel Valley UT USA,University of Utah Regional Network
US,MVCO,37.2103,-108.4986,2170 m,48 km,0.2 km,1.80,0.01,6.476 km/s,3.598 km/s,0.28,200,0.60,Mesa Verde Colorado USA,United States National Seismic Network
UU,BGU,40.92083,-113.02983,1640 m,30 km,0.3 km,1.72,0.01,6.276 km/s,3.649 km/s,0.24,200,0.41,Big Grassy Mountain UT USA,University of Utah Regional Network
LB,BMN,40.43147,-117.22178,1500 m,30 km,0.1 km,1.76,0.01,6.276 km/s,3.566 km/s,0.26,200,0.28,Battle Mountain Nevada USA,Leo Brady Network
UU,FOR1,38.3689,-113.0938,1642 m,36 km,0.2 km,1.80,0.01,6.276 km/s,3.487 km/s,0.28,85,0.49,Milford Southwest UT USA,University of Utah Regional Network
UU,BRPU,39.473,-110.74,1687 m,44 km,1.0 km,1.78,0.04,6.207 km/s,3.487 km/s,0.27,200,0.62,Butcher Ranch Price UT USA old TA-P17A,University of Utah Regional Network
UU,CTU,40.6925,-111.75034,1731 m,32 km,0.2 km,1.79,0.01,6.155 km/s,3.439 km/s,0.27,200,0.44,Camp Tracy UT USA,University of Utah Regional Network
CI,GRA,36.99608,-117.36621,689 m,36 km,0.2 km,1.98,0.01,6.279 km/s,3.171 km/s,0.33,200,0.55,Grapevine Ranger Station Death Valley CA USA,Caltech Regional Seismic Network
UU,GAWY,41.740433,-109.852104,2011 m,41 km,2.2 km,1.78,0.05,6.207 km/s,3.487 km/s,0.27,20,0.59,Genesis Alkali Granger WY USA,University of Utah Regional Network
NE,HNH,43.7051,-72.2865,180 m,34 km,4.4 km,1.91,0.11,6.419 km/s,3.361 km/s,0.31,148,0.69,Hanover NH,New England Seismic Network
NM,EUAL,32.97143,-88.08669,76 m,35 km,3.9 km,1.72,0.03,6.201 km/s,3.605 km/s,0.24,8,0.63,Eutaw AL,Cooperative New Madrid Seismic Network
CI,GSC,35.30177,-116.80574,1000 m,25 km,0.0 km,1.87,0.02,6.276 km/s,3.356 km/s,0.30,200,0.69,Goldstone Goldstone Lake CA USA,Caltech Regional Seismic Network
NE,BRYW,41.917,-71.5378,107 m,34 km,0.2 km,1.80,0.01,6.472 km/s,3.596 km/s,0.28,104,0.45,Smithfield RI,New England Seismic Network
IU,WVT,36.1297,-87.83,170 m,36 km,2.4 km,2.00,0.06,6.444 km/s,3.222 km/s,0.33,200,0.71,Waverly Tennessee USA,Global Seismograph Network (GSN - IRIS/USGS)
UU,ECUT,39.171696,-112.1332,2136 m,32 km,1.5 km,1.85,0.03,6.276 km/s,3.392 km/s,0.29,23,0.59,Ebbs Canyon Scipio UT USA,University of Utah Regional Network
NE,TRY,42.7305,-73.6658,131 m,31 km,6.0 km,2.01,0.12,6.419 km/s,3.194 km/s,0.34,159,0.74,Troy NY,New England Seismic Network
NE,QUA2,42.279,-72.3521,175 m,30 km,0.5 km,1.71,0.03,6.419 km/s,3.754 km/s,0.24,114,0.30,Belchertown MA,New England Seismic Network
NW,HQIL,41.79982,-87.85343,193 m,41 km,0.7 km,1.78,0.01,6.498 km/s,3.651 km/s,0.27,38,0.58,Hanson (Federal McCook) Quary Illinois U.S.A.,Northwestern University Seismic Network
WY,YTP,44.39183,-110.285,2384 m,39 km,1.0 km,1.67,0.02,6.35 km/s,3.802 km/s,0.22,190,0.74,The Promontory YNP WY USA,Yellowstone Wyoming Seismic Network
UU,TCU,41.11733,-111.40784,2269 m,48 km,0.1 km,1.60,0.00,6.155 km/s,3.847 km/s,0.18,135,0.80,Toone Canyon UT USA,University of Utah Regional Network
GS,KAN12,37.297382,-97.998,426 m,42 km,2.1 km,1.80,0.06,6.483 km/s,3.602 km/s,0.28,42,0.66,Houston Home Harper KS USA,US Geological Survey Networks
NN,CMK6,39.3102,-118.1193,1332 m,32 km,0.2 km,1.71,0.01,6.279 km/s,3.672 km/s,0.24,59,0.40,Chalk Mountain Churchill County NV USA,Western Great Basin/Eastern Sierra Nevada
UU,SPU,41.30867,-112.44917,2086 m,28 km,0.3 km,1.68,0.02,6.276 km/s,3.736 km/s,0.23,200,0.51,South Promontory Point UT USA,University of Utah Regional Network
UU,SZCU,37.5954,-113.0875,2026 m,38 km,0.2 km,1.74,0.01,6.194 km/s,3.56 km/s,0.25,174,0.52,Shurtz Canyon UT USA,University of Utah Regional Network
UU,JLU,40.60195,-111.44995,2285 m,36 km,4.1 km,1.72,0.09,6.155 km/s,3.578 km/s,0.24,171,0.73,Jordanelle UT USA,University of Utah Regional Network
UU,PSUT,38.5337,-113.8547,1999 m,38 km,0.5 km,1.70,0.02,6.276 km/s,3.692 km/s,0.24,200,0.56,Pine Spring UT USA,University of Utah Regional Network
IU,SSPA,40.6358,-77.8876,270 m,42 km,0.1 km,1.83,0.01,6.121 km/s,3.345 km/s,0.29,200,0.46,Standing Stone Pennsylvania,Global Seismograph Network (GSN - IRIS/USGS)
GS,OK048,36.41622,-96.94374,297 m,42 km,0.2 km,1.82,0.01,6.483 km/s,3.562 km/s,0.28,55,0.48,Pawnee OK Station 48,US Geological Survey Networks
NM,HBAR,35.555,-90.657,74 m,26 km,3.3 km,2.09,0.10,6.273 km/s,3.001 km/s,0.35,67,0.77,HarrisburgAR(CERI),Cooperative New Madrid Seismic Network
ET,CPCT,35.45,-84.522,275 m,44 km,0.4 km,1.81,0.02,6.35 km/s,3.508 km/s,0.28,96,0.49,Cooper CaveTN,CERI Southern Appalachian seismic Network
ET,SWET,35.216,-85.932,581 m,29 km,1.7 km,2.10,0.07,6.35 km/s,3.024 km/s,0.35,99,0.76,SewaneeTN,CERI Southern Appalachian seismic Network
NM,FFIL,38.381344,-88.38965,446 m,49 km,4.2 km,1.83,0.08,6.444 km/s,3.521 km/s,0.29,124,0.78,Fairfield IL,Cooperative New Madrid Seismic Network
NM,X502,35.4903,-92.3868,344 m,38 km,6.0 km,1.89,0.11,6.498 km/s,3.438 km/s,0.31,41,0.72,Temporary Arkansas,Cooperative New Madrid Seismic Network
GS,OK029,35.79657,-97.45486,333 m,41 km,2.1 km,1.88,0.05,6.426 km/s,3.418 km/s,0.30,100,0.73,Liberty Lake Oklahoma USA,US Geological Survey Networks
AG,LCAR,36.07,-91.154,103 m,45 km,6.0 km,1.78,0.14,6.53 km/s,3.669 km/s,0.27,156,0.64,Lake CharlesAR,Arkansas Seismic Network
NN,GWY,36.186,-116.6698,1538 m,25 km,1.0 km,1.92,0.03,6.279 km/s,3.27 km/s,0.31,108,0.64,Greenwater Valley CA. (GPS 12/06/2000) w84gm,Western Great Basin/Eastern Sierra Nevada
CO,CASEE,34.993,-82.9317,385 m,51 km,5.2 km,1.75,0.06,6.35 km/s,3.629 km/s,0.26,136,0.75,Lake Jocassee SC USA,South Carolina Seismic Network
NM,GLAT,36.269,-89.288,120 m,25 km,1.2 km,2.10,0.03,6.444 km/s,3.069 km/s,0.35,91,0.76,GlassTN,Cooperative New Madrid Seismic Network
NE,YLE,41.3165,-72.9209,10 m,31 km,0.1 km,1.74,0.01,6.472 km/s,3.72 km/s,0.25,76,0.33,New Haven CT,New England Seismic Network
NM,HICK,36.541,-89.229,141 m,39 km,2.0 km,1.64,0.04,6.444 km/s,3.929 km/s,0.20,95,0.70,HickmanKY,Cooperative New Madrid Seismic Network
NM,CGM3,37.29775,-89.6582,148 m,31 km,0.6 km,2.09,0.02,6.444 km/s,3.083 km/s,0.35,100,0.69,Cape Girardeau MO,Cooperative New Madrid Seismic Network
TX,FW07,32.702465,-97.786095,311 m,42 km,0.2 km,1.79,0.01,6.38 km/s,3.564 km/s,0.27,51,0.48,Weatherford,Texas Seismological Network
TX,FW16,32.48187,-96.89716,215 m,40 km,2.4 km,1.91,0.06,6.38 km/s,3.34 km/s,0.31,34,0.46,Waxahatchie,Texas Seismological Network
AZ,RRSP,33.6515,-116.7394,1610 m,32 km,0.2 km,1.81,0.01,6.264 km/s,3.461 km/s,0.28,129,0.26,RRSP CA USA,ANZA Regional Network
NN,R11B,38.3489,-115.5854,1767 m,34 km,1.5 km,1.72,0.05,6.276 km/s,3.649 km/s,0.24,9,0.46,Troy Canyon Currant NV USA,Western Great Basin/Eastern Sierra Nevada
NN,Q09A,38.834,-117.1816,1704 m,36 km,6.8 km,1.95,0.12,6.276 km/s,3.218 km/s,0.32,45,0.68,Carvers NV USA - NN reactivation,Western Great Basin/Eastern Sierra Nevada
US,AAM,42.30119,-83.65669,172 m,41 km,0.2 km,1.93,0.01,6.483 km/s,3.359 km/s,0.32,200,0.45,Ann Arbor Michigan USA,United States National Seismic Network
CO,CSB,32.98698,-80.07155,6.0 m,30 km,5.3 km,1.99,0.12,6.565 km/s,3.299 km/s,0.33,14,0.64,Charleston Southern University Charleston SC USA,South Carolina Seismic Network
TX,FW03,33.039623,-98.0652,322 m,43 km,0.8 km,1.75,0.02,6.426 km/s,3.672 km/s,0.26,48,0.59,Perrin-Whitt Elementary School,Texas Seismological Network
NN,RYN,38.6281,-118.5223,1651 m,36 km,1.4 km,1.74,0.04,6.279 km/s,3.609 km/s,0.25,181,0.64,Ryan Nevada w84gps,Western Great Basin/Eastern Sierra Nevada
US,BINY,42.19931,-75.98612,498 m,47 km,0.2 km,1.75,0.01,6.419 km/s,3.668 km/s,0.26,200,0.56,Binghamton New York USA,United States National Seismic Network
IU,RSSD,44.12042,-104.03619,2060 m,34 km,5.7 km,2.04,0.13,6.242 km/s,3.06 km/s,0.34,200,0.83,Black Hills South Dakota USA,Global Seismograph Network (GSN - IRIS/USGS)
IU,CCM,38.0557,-91.2446,222 m,46 km,0.1 km,1.77,0.00,6.498 km/s,3.671 km/s,0.27,200,0.54,Cathedral Cave Missouri USA,Global Seismograph Network (GSN - IRIS/USGS)
TX,FW06,32.97256,-97.55693,233 m,41 km,1.9 km,1.75,0.04,6.38 km/s,3.646 km/s,0.26,53,0.62,Azle,Texas Seismological Network
O2,SC15,35.606644,-99.50059,550 m,27 km,9.6 km,2.10,0.22,6.315 km/s,3.007 km/s,0.35,4,0.66,Hammon Oklahoma USA,Oklahoma Consolidated Temporary Seismic Networks
US,SCIA,41.9069,-93.2153,312 m,48 km,0.2 km,1.78,0.01,6.498 km/s,3.651 km/s,0.27,200,0.67,State Center Iowa USA,United States National Seismic Network
NM,HALT,35.911,-89.34,85 m,26 km,3.0 km,2.10,0.10,6.38 km/s,3.038 km/s,0.35,79,0.82,HallsTN,Cooperative New Madrid Seismic Network
ET,FPAL,34.54,-85.611,556 m,47 km,0.4 km,1.79,0.01,6.35 km/s,3.547 km/s,0.27,144,0.53,Fort PayneAL,CERI Southern Appalachian seismic Network
NM,SIUC,37.7148,-89.2174,120 m,49 km,3.4 km,1.73,0.08,6.444 km/s,3.725 km/s,0.25,200,0.65,Carbondale IL,Cooperative New Madrid Seismic Network
NM,HENM,36.716,-89.472,88 m,28 km,2.9 km,1.75,0.10,6.444 km/s,3.682 km/s,0.26,129,0.74,Henderson MoundMO,Cooperative New Madrid Seismic Network
US,MIAR,34.54539,-93.5765,207 m,27 km,0.2 km,1.82,0.01,6.498 km/s,3.57 km/s,0.28,200,0.73,Mount Ida Arkansas USA,United States National Seismic Network
US,OXF,34.51181,-89.4092,101 m,34 km,0.1 km,1.60,0.00,6.38 km/s,3.987 km/s,0.18,200,0.82,Oxford Mississippi USA,United States National Seismic Network
BK,HUMO,42.6071,-122.95669,555 m,25 km,5.5 km,2.03,0.14,6.522 km/s,3.213 km/s,0.34,200,0.79,Hull Mountain OR,Berkeley Digital Seismograph Network
US,OGNE,40.9451,-102.033,0.0 m,52 km,3.4 km,1.62,0.08,6.483 km/s,4.002 km/s,0.19,200,0.87,Ogallala Nebraska USA,United States National Seismic Network
US,BLA,37.2113,-80.421,634 m,46 km,0.3 km,1.83,0.01,6.159 km/s,3.366 km/s,0.29,200,0.59,Blacksburg Virginia USA,United States National Seismic Network
US,CBN,38.205,-77.37334,70 m,28 km,2.7 km,1.94,0.07,6.419 km/s,3.309 km/s,0.32,199,0.56,Corbin (Fredericksburg Observatory) Virginia USA,United States National Seismic Network
GS,ASL9,34.94591,-106.4572,1820 m,41 km,0.8 km,1.67,0.01,6.502 km/s,3.893 km/s,0.22,69,0.58,Albuquerque New Mexico USA,US Geological Survey Networks
US,NHSC,33.10669,-80.1778,11 m,35 km,4.7 km,1.83,0.13,6.565 km/s,3.587 km/s,0.29,176,0.72,New Hope South Carolina USA,United States National Seismic Network
IU,ANMO,34.9462,-106.4567,1840 m,42 km,0.3 km,1.65,0.01,6.502 km/s,3.941 km/s,0.21,200,0.54,Albuquerque New Mexico USA,Global Seismograph Network (GSN - IRIS/USGS)
TX,BRDY,31.27103,-99.00493,460 m,38 km,0.3 km,1.79,0.01,6.498 km/s,3.63 km/s,0.27,68,0.44,Brady,Texas Seismological Network
US,EGMT,48.024,-109.7547,1055 m,38 km,3.4 km,1.92,0.06,6.438 km/s,3.353 km/s,0.31,200,0.72,Eagleton Montana USA,United States National Seismic Network
UW,IRON,43.358,-118.4743,1229 m,33 km,0.1 km,1.79,0.00,6.279 km/s,3.508 km/s,0.27,200,0.52,Circle Bar Ranch Crane OR USA,Pacific Northwest Regional Seismic Network
US,BMO,44.84889,-117.30556,1189 m,29 km,1.1 km,1.84,0.02,6.571 km/s,3.571 km/s,0.29,200,0.66,Blue Mountains Array (Baker) Oregon USA,United States National Seismic Network
US,SDCO,37.74561,-105.50122,2569 m,46 km,1.8 km,1.86,0.06,6.316 km/s,3.396 km/s,0.30,200,0.71,Great Sand Dunes National Park Colorado USA,United States National Seismic Network
WY,YMR,44.66867,-110.965,2149 m,48 km,0.2 km,1.79,0.01,6.35 km/s,3.547 km/s,0.27,183,0.56,Madison River YNP WY USA,Yellowstone Wyoming Seismic Network
UU,MPU,40.0155,-111.63333,1909 m,34 km,0.9 km,1.75,0.02,6.155 km/s,3.517 km/s,0.26,132,0.49,Maple Canyon UT USA,University of Utah Regional Network
UU,MTPU,38.0415,-112.1843,3112 m,25 km,5.5 km,1.62,0.13,6.276 km/s,3.874 km/s,0.19,154,0.95,Mt. Pierson UT USA,University of Utah Regional Network
IW,PHWY,41.3016,-105.4577,2645 m,49 km,3.2 km,1.81,0.07,6.306 km/s,3.484 km/s,0.28,200,0.69,Pilot Hill Wyoming USA,Intermountain West
IW,SNOW,43.4625,-110.7552,2390 m,43 km,3.6 km,1.62,0.12,6.207 km/s,3.831 km/s,0.19,200,0.81,Snow King Mountain Wyoming USA,Intermountain West
WY,YHL,44.8509,-111.183,2691 m,26 km,0.4 km,1.98,0.03,6.35 km/s,3.207 km/s,0.33,194,0.65,Hebgen Lake YNP WY USA,Yellowstone Wyoming Seismic Network
UU,NLU,39.95483,-112.075,2036 m,32 km,0.2 km,1.77,0.01,6.276 km/s,3.546 km/s,0.27,150,0.38,North Lily UT USA,University of Utah Regional Network
IU,TUC,32.3096,-110.7846,874 m,32 km,0.5 km,1.71,0.03,6.276 km/s,3.67 km/s,0.24,200,0.63,Tucson Arizona,Global Seismograph Network (GSN - IRIS/USGS)
IU,COR,44.5857,-123.3032,121 m,38 km,0.2 km,2.03,0.01,6.566 km/s,3.234 km/s,0.34,200,0.39,Corvallis Oregon USA,Global Seismograph Network (GSN - IRIS/USGS)
UU,LIUT,39.4241,-110.3251,2178 m,40 km,2.9 km,1.88,0.05,6.207 km/s,3.302 km/s,0.30,102,0.52,Lila Canyon UT USA,University of Utah Regional Network
TX,SAND,29.95471,-102.12331,689 m,39 km,0.2 km,1.75,0.01,6.419 km/s,3.668 km/s,0.26,58,0.40,Sanderson,Texas Seismological Network
UU,NOQ,40.6525,-112.12033,1622 m,43 km,8.6 km,1.87,0.13,6.276 km/s,3.356 km/s,0.30,168,0.80,North Oquirrh Mountains UT USA,University of Utah Regional Network
TX,VHRN,30.7866,-104.98515,1342 m,40 km,2.1 km,1.68,0.06,6.361 km/s,3.786 km/s,0.23,61,0.71,Van Horn,Texas Seismological Network
UU,ZNPU,37.3561,-113.1254,1953 m,50 km,1.2 km,1.65,0.02,6.194 km/s,3.754 km/s,0.21,160,0.66,Zion National Park UT USA,University of Utah Regional Network
TA,WHTX,31.9913,-97.4561,190 m,42 km,0.2 km,1.75,0.01,6.347 km/s,3.627 km/s,0.26,200,0.54,Lake Whitney Meridian TX USA,USArray Transportable Network (new EarthScope stations)
CI,PASC,34.17141,-118.18523,341 m,39 km,5.2 km,1.60,0.18,6.1 km/s,3.812 km/s,0.18,161,0.82,Pasadena Art Center College of Design,Caltech Regional Seismic Network
US,GLMI,44.8245,-84.6174,387 m,25 km,6.0 km,1.60,0.06,6.483 km/s,4.052 km/s,0.18,200,0.99,Grayling Michigan USA,United States National Seismic Network
N4,L40A,42.0628,-91.2218,242 m,40 km,0.1 km,1.77,0.01,6.53 km/s,3.689 km/s,0.27,122,0.40,Anamosa IA USA,Central and EAstern US Network
BK,CMB,38.03455,-120.38651,697 m,56 km,3.5 km,1.74,0.04,6.597 km/s,3.791 km/s,0.25,200,0.85,Columbia College Columbia CA,Berkeley Digital Seismograph Network
BK,MCCM,38.14478,-122.88018,-7.7 m,26 km,0.3 km,1.74,0.01,6.472 km/s,3.72 km/s,0.25,185,0.28,Marconi Conference Center Marshall CA USA,Berkeley Digital Seismograph Network
IM,PD31,42.7672,-109.5581,2219 m,30 km,6.6 km,1.94,0.15,6.161 km/s,3.176 km/s,0.32,200,0.68,PDAR Array Pinedale WY USA,International Miscellaneous Stations
PB,B088A,33.37495,-116.62052,1404 m,30 km,1.1 km,1.83,0.04,6.264 km/s,3.423 km/s,0.29,92,0.53,skyoks088bcs2007 Anza CA USA,Plate Boundary Observatory Borehole Seismic Network
NE,WES,42.3848,-71.3218,60 m,30 km,0.1 km,1.76,0.01,6.419 km/s,3.647 km/s,0.26,157,0.31,Weston MA,New England Seismic Network
NE,BCX,42.335,-71.1705,60 m,29 km,0.2 km,1.75,0.01,6.419 km/s,3.668 km/s,0.26,93,0.33,Chestnut Hill MA USA,New England Seismic Network
GS,KS20,37.22973,-97.55432,372 m,27 km,5.9 km,1.60,0.12,6.483 km/s,4.052 km/s,0.18,13,0.83,W. 40th St. S. and S. Mayfield Rd. Wellington KS USA,US Geological Survey Networks
US,RLMT,45.1221,-109.2673,2086 m,25 km,13 km,1.68,0.08,6.242 km/s,3.715 km/s,0.23,200,0.91,Red Lodge Montana USA,United States National Seismic Network
UU,TCRU,38.6095,-112.4472,2293 m,37 km,0.2 km,1.82,0.01,6.276 km/s,3.448 km/s,0.28,147,0.54,Three Creek Reservoir UT USA,University of Utah Regional Network
UU,PKCU,37.4439,-112.311,2834 m,25 km,3.5 km,1.60,0.11,6.194 km/s,3.871 km/s,0.18,89,0.98,Pink Cliffs UT USA,University of Utah Regional Network
US,MSO,46.82917,-113.94055,1264 m,38 km,0.2 km,1.71,0.01,6.353 km/s,3.715 km/s,0.24,200,0.45,Missoula Montana USA,United States National Seismic Network
US,AHID,42.76539,-111.10039,1960 m,27 km,0.2 km,2.10,0.00,6.207 km/s,2.956 km/s,0.35,200,0.66,Auburn Hatchery Idaho USA,United States National Seismic Network
NE,WSPT,41.1712,-73.3278,91 m,30 km,0.1 km,1.73,0.01,6.472 km/s,3.741 km/s,0.25,99,0.29,Westport CT USA,New England Seismic Network
UU,FOR3,38.5133,-112.8809,1699 m,33 km,4.4 km,1.89,0.10,6.276 km/s,3.321 km/s,0.31,37,0.64,Blundell North UT USA,University of Utah Regional Network
UU,VRUT,37.4618,-113.8569,1874 m,36 km,0.5 km,1.76,0.01,6.194 km/s,3.519 km/s,0.26,200,0.57,Veyo Road Veyo UT USA,University of Utah Regional Network
LB,TPH,38.075,-117.2225,1883 m,35 km,0.1 km,1.75,0.01,6.276 km/s,3.586 km/s,0.26,200,0.28,Tonopah Nevada USA,Leo Brady Network
US,COWI,46.1003,-89.1369,523 m,42 km,0.1 km,1.75,0.00,6.467 km/s,3.695 km/s,0.26,200,0.58,Conover Wisconsin USA,United States National Seismic Network
US,PKME,45.2644,-69.2917,108 m,34 km,0.2 km,1.72,0.01,6.419 km/s,3.732 km/s,0.24,177,0.41,Peaks-Kenny State Park Maine USA,United States National Seismic Network
NM,SLM,38.6361,-90.2364,186 m,44 km,2.0 km,1.92,0.08,6.498 km/s,3.384 km/s,0.31,200,0.79,St. Louis MO,Cooperative New Madrid Seismic Network
UU,FOR4,38.4986,-112.8965,1657 m,25 km,9.8 km,1.68,0.15,6.276 km/s,3.736 km/s,0.23,4,0.95,Blundell West UT USA,University of Utah Regional Network
US,NATX,31.75978,-94.66097,156 m,30 km,0.5 km,1.81,0.01,5.738 km/s,3.17 km/s,0.28,130,0.49,Nacogdoches Texas USA,United States National Seismic Network
CO,TEEBA,32.8975,-80.1911,11 m,36 km,4.7 km,1.89,0.08,6.565 km/s,3.474 km/s,0.31,14,0.59,Mateeba Summerville SC,South Carolina Seismic Network
US,AGMN,48.2977,-95.8619,351 m,49 km,0.6 km,1.68,0.01,6.419 km/s,3.821 km/s,0.23,200,0.63,Agassiz National Wildlife Refuge Minnesota USA,United States National Seismic Network
CO,JSC,34.2818,-81.25966,103 m,35 km,0.2 km,1.71,0.01,6.419 km/s,3.754 km/s,0.24,58,0.37,Jenkinsville South Carolina,South Carolina Seismic Network
TA,D47A,47.0558,-83.1038,498 m,41 km,0.5 km,1.83,0.04,6.467 km/s,3.534 km/s,0.29,61,0.62,Chapleau ON CAN,USArray Transportable Network (new EarthScope stations)
GS,OK052,35.99361,-96.80278,259 m,42 km,0.7 km,1.83,0.01,6.426 km/s,3.511 km/s,0.29,42,0.58,Battle Ridge Rd NW of Cushing OK USA,US Geological Survey Networks
GS,KAN16,37.225616,-98.06472,435 m,42 km,4.7 km,1.85,0.07,6.426 km/s,3.474 km/s,0.29,19,0.52,SW of Harper Kansas - Bergman residence,US Geological Survey Networks
UU,FOR2,38.495,-112.8723,1760 m,35 km,0.2 km,1.83,0.01,6.276 km/s,3.43 km/s,0.29,41,0.50,Blundell East UT USA,University of Utah Regional Network
WY,YHH,44.78833,-110.8505,2717 m,30 km,13 km,1.93,0.14,6.35 km/s,3.29 km/s,0.32,157,0.74,Holmes Hill YNP WY USA,Yellowstone Wyoming Seismic Network
UU,SWUT,39.3286,-113.1954,1644 m,29 km,0.2 km,1.77,0.01,6.276 km/s,3.546 km/s,0.27,199,0.42,Soap Wash Delta UT USA,University of Utah Regional Network
UW,DDRF,46.4911,-119.0595,233 m,32 km,0.7 km,1.76,0.03,6.419 km/s,3.647 km/s,0.26,174,0.58,Dider Farm Eltopia WA USA,Pacific Northwest Regional Seismic Network
AG,U40A,36.3563,-92.8535,374 m,46 km,1.3 km,1.74,0.02,6.53 km/s,3.753 km/s,0.25,71,0.65,Yellville AR,Arkansas Seismic Network
UO,DING,42.86189,-124.05399,100 m,26 km,1.0 km,2.10,0.12,6.048 km/s,2.88 km/s,0.35,5,0.47,Powers OR USA,University of Oregon Regional Network
TO,CC32,36.3326,-119.1934,112 m,30 km,2.8 km,1.60,0.06,6.291 km/s,3.932 km/s,0.18,62,0.89,CCSE CC32,Tectonic Observatory
US,LAO,46.6885,-106.22311,902 m,38 km,0.9 km,2.10,0.02,6.438 km/s,3.066 km/s,0.35,200,0.75,LASA Array Montana USA,United States National Seismic Network
TO,CC33,36.3442,-119.1224,126 m,27 km,15 km,1.60,0.15,6.291 km/s,3.932 km/s,0.18,65,0.90,CCSE CC33,Tectonic Observatory
UU,SVWY,41.450253,-109.864685,1950 m,41 km,2.4 km,1.80,0.07,6.207 km/s,3.448 km/s,0.28,27,0.53,Solvay Mine WY USA,University of Utah Regional Network
TX,PB11,31.93553,-104.03412,915 m,28 km,3.3 km,1.66,0.04,6.361 km/s,3.832 km/s,0.22,19,0.60,Snyder 1,Texas Seismological Network
NE,PQI,46.6701,-68.0133,175 m,34 km,0.3 km,1.77,0.01,6.419 km/s,3.627 km/s,0.27,112,0.47,Presque Isle ME,New England Seismic Network
